id,name,indication,solution,medic_type_id,score,symptom_id
ae8e5b01-f63d-4fe9-9162-79eafd87d250,Травмы шейного отдела позвоночника.,"Появлению болей предшествуют травмы: удар по голове или головой, падение, удар о дно при нырянии. В последние годы увеличилось количество травм, связанных с повреждением шейного отдела позвоночника при дорожно-транспортных происшествиях. Механизм травматизма зависит от вида столкновения. При лобовом ударе происходит резкое сгибание шеи с последующим резким разгибанием. При ударе в автомобиль сзади — резкое разгибание с последующим резким сгибанием. При таких видах травм происходит повреждение мышц, связочного аппарата позвоночника, спинномозговых нервных корешков, позвонков, вплоть до их переломов. Из-за анатомического строения шеи эти повреждения, как правило, сочетаются. Травмы с переломом тел шейных позвонков чрезвычайно опасны и представляют серьезную угрозу для жизни из-за возможного повреждения спинного мозга с нарушением деятельности дыхательного и сосудистого центров, появления параличей и нарушения всех видов чувствительности.","в первую очередь уложить травмированного в горизонтальное положение, уменьшить движения в шейном отделе позвоночника с помощью валиков из подручных средств, немедленно доставить в лечебное учреждение для осмотра врачом-травматологом, хирургом.",0cbbf422-be4a-419e-86ee-a14adddbd22e,1,0558e0a9-0c52-4b33-b465-7a9f993fbeb0
b28647a8-7a27-4e95-a3cd-6d5826613aa5,Миозит,"Причинами данного заболевания могут быть: переохлаждение, травмирование мышцы, ее физическое перенапряжение при подъеме тяжестей или при физических упражнениях.","обезболивающие препараты, противовоспалительные мази, сухое тепло.",1cf41adb-40f0-46eb-b702-d0bf2cc3f60b,3,0558e0a9-0c52-4b33-b465-7a9f993fbeb0
bdad7c0f-5e9b-4df7-a86b-bb60172061a5,Тиреоидит,"боль в области передней поверхности шеи, отдает в верхнюю, нижнюю челюсть, затылок. Боль усиливается при движениях головы, характерно усиление болей в шее при глотании. Нажатие в области проекции щитовидной железы (по переднебоковой поверхности шеи в верхних отделах) — болезненно.",осуществляет врач-эндокринолог.,0cbbf422-be4a-419e-86ee-a14adddbd22e,4,0558e0a9-0c52-4b33-b465-7a9f993fbeb0
6a4a0b6b-8450-4e87-9006-84e55dfe9d01,Остеохондроз,"это деструктивно-дегенеративные изменения позвонков и межпозвонковых дисков, приводящие к смещению по- звонков и их воздействию на нервные стволы, отходящие от спинного мозга.

Проявления: шейная боль — цервикалгия. Как правило, возникает внезапно, по типу «прострела». Боль в шейно-затылочной области, чаще односторонняя, возникает при неловком движении, резком повороте головы, при физической нагрузке, при чихании, кашле. Помимо боли возникает резкое ограничение в движениях, больной принимает вынужденное щадящее положение. Боль может распространяться в надплечье, надлопаточную область, в руку. Могут быть нарушения чувствительности в виде онемения или «мурашек» в кисти и пальцах. Боль усиливается при поднятии руки, при отведении ее назад, при движениях головы, при кашле. Интенсивность болей снижается в тепле, при приеме горячей ванны. Иногда может сопровождаться головокружением, шаткостью походки. Мышцы напряжены, при нажатии на них ощущается болезненность.","осуществляет врач-невролог, до этого можно применять обезболивающие препараты, противовоспалительные мази, сухое тепло.",1cf41adb-40f0-46eb-b702-d0bf2cc3f60b,2,0558e0a9-0c52-4b33-b465-7a9f993fbeb0
